{
  "manifest_version": 1,
  "access_date": "2026-08-13",
  "user_agent": "SomniumEngine-terrain-fetch/XV",
  "sidecar_version_when_shipping": 3,
  "layer_count": 16,
  "max_stored_nonzero_per_texel": 4,
  "license_policy": "CC0-1.0 only. Fail closed on unknown license, hash mismatch, missing packer map, or resolution change.",
  "packer_maps": [
    "diff",
    "nor_dx",
    "arm",
    "disp"
  ],
  "polyhaven_files_key": {
    "diff": "Diffuse",
    "nor_dx": "nor_dx",
    "arm": "arm",
    "disp": "Displacement"
  },
  "rejected_for_role": [
    {
      "planned_index": 11,
      "id": "terrain_red_01",
      "reason": "First-party category is crushed reddish gravel, overlapping layer 7, not red mineral soil.",
      "page_url": "https://polyhaven.com/a/terrain_red_01",
      "substitute_id": "cracked_red_ground",
      "files_hash": "16bb30d34d23a75c1dea32f0d01cd89212160bc8"
    },
    {
      "planned_index": 15,
      "id": "dry_riverbed_rock",
      "reason": "First-party category is Rough Rock Faces, overlapping layer 14, not loose talus/river stone.",
      "page_url": "https://polyhaven.com/a/dry_riverbed_rock",
      "substitute_id": "ganges_river_pebbles",
      "files_hash": "aa87f826fc4326cd3e4ecd9d73e3644e18e86ed1"
    }
  ],
  "layers": [
    {
      "index": 0,
      "id": "aerial_grass_rock",
      "display_name": "Grass",
      "role_tags": [
        "grass",
        "ground"
      ],
      "biome_tags": [
        "meadow",
        "forest-edge"
      ],
      "compatibility_locked": true,
      "source": "polyhaven",
      "page_url": "https://polyhaven.com/a/aerial_grass_rock",
      "license": "CC0-1.0",
      "license_url": "https://creativecommons.org/publicdomain/zero/1.0/",
      "authors": {
        "Rob Tuytel": "All"
      },
      "files_hash": "d610669c24e20d7c2effc4c116c718176f5b044a",
      "physical_width_m": 15.0,
      "physical_height_m": 15.0,
      "colour_space": "sRGB",
      "normal_convention": "DirectX",
      "moisture_affinity": 0.55,
      "cliff_suitability": 0.35,
      "uv_scale_multiplier": 0.266667,
      "ambientcg_fallback": {
        "id": "Grass005",
        "page_url": "https://ambientcg.com/a/Grass005"
      },
      "notes": "Aerial grass-over-stone. Current engine tiling 4 m vs 15 m physical.",
      "files": {
        "2k": {
          "diff": {
            "url": "https://dl.polyhaven.org/file/ph-assets/Textures/jpg/2k/aerial_grass_rock/aerial_grass_rock_diff_2k.jpg",
            "bytes": 2624635,
            "md5": "024018554c0002620127749d1f585f3d",
            "sha256": null
          },
          "nor_dx": {
            "url": "https://dl.polyhaven.org/file/ph-assets/Textures/jpg/2k/aerial_grass_rock/aerial_grass_rock_nor_dx_2k.jpg",
            "bytes": 3879028,
            "md5": "55466b239d3781482d22fc3387b76b73",
            "sha256": null
          },
          "arm": {
            "url": "https://dl.polyhaven.org/file/ph-assets/Textures/jpg/2k/aerial_grass_rock/aerial_grass_rock_arm_2k.jpg",
            "bytes": 945301,
            "md5": "1491ee517b5cf713639f3add1b91c933",
            "sha256": null
          },
          "disp": {
            "url": "https://dl.polyhaven.org/file/ph-assets/Textures/jpg/2k/aerial_grass_rock/aerial_grass_rock_disp_2k.jpg",
            "bytes": 530342,
            "md5": "a02fe96ebd14dabd8fc7a829f4a77bac",
            "sha256": null
          }
        },
        "4k": {
          "diff": {
            "url": "https://dl.polyhaven.org/file/ph-assets/Textures/jpg/4k/aerial_grass_rock/aerial_grass_rock_diff_4k.jpg",
            "bytes": 9067116,
            "md5": "dc4dbd56d49f3278d1fcde8e58159a84",
            "sha256": null
          },
          "nor_dx": {
            "url": "https://dl.polyhaven.org/file/ph-assets/Textures/jpg/4k/aerial_grass_rock/aerial_grass_rock_nor_dx_4k.jpg",
            "bytes": 16759860,
            "md5": "fbeb2c5bbe69d3a44df2c5591aead73b",
            "sha256": null
          },
          "arm": {
            "url": "https://dl.polyhaven.org/file/ph-assets/Textures/jpg/4k/aerial_grass_rock/aerial_grass_rock_arm_4k.jpg",
            "bytes": 4053803,
            "md5": "9240c4cbe69b8d8c8931ad533adf1f78",
            "sha256": null
          },
          "disp": {
            "url": "https://dl.polyhaven.org/file/ph-assets/Textures/jpg/4k/aerial_grass_rock/aerial_grass_rock_disp_4k.jpg",
            "bytes": 1528355,
            "md5": "8d8734171639458ebe4318dbe430caea",
            "sha256": null
          }
        }
      },
      "current_engine_tiling_per_m": 0.25,
      "blend": {
        "height_scale": 0.5,
        "blend_width": 0.5,
        "min_weight": 0.1,
        "parallax_depth_m": 0.02
      }
    },
    {
      "index": 1,
      "id": "forrest_ground_01",
      "display_name": "Forest Floor",
      "role_tags": [
        "forest-floor",
        "leaf-litter"
      ],
      "biome_tags": [
        "forest"
      ],
      "compatibility_locked": true,
      "source": "polyhaven",
      "page_url": "https://polyhaven.com/a/forrest_ground_01",
      "license": "CC0-1.0",
      "license_url": "https://creativecommons.org/publicdomain/zero/1.0/",
      "authors": {
        "Rob Tuytel": "All"
      },
      "files_hash": "ea3ef3539e362d9a9ffa409ecd467d08028569d5",
      "physical_width_m": 2.0,
      "physical_height_m": 2.0,
      "colour_space": "sRGB",
      "normal_convention": "DirectX",
      "moisture_affinity": 0.7,
      "cliff_suitability": 0.05,
      "uv_scale_multiplier": 2.0,
      "ambientcg_fallback": {
        "id": "Ground037",
        "page_url": "https://ambientcg.com/a/Ground037"
      },
      "notes": "",
      "files": {
        "2k": {
          "diff": {
            "url": "https://dl.polyhaven.org/file/ph-assets/Textures/jpg/2k/forrest_ground_01/forrest_ground_01_diff_2k.jpg",
            "bytes": 3077552,
            "md5": "18fa30c294be21805159ca6e73a5e5fa",
            "sha256": null
          },
          "nor_dx": {
            "url": "https://dl.polyhaven.org/file/ph-assets/Textures/jpg/2k/forrest_ground_01/forrest_ground_01_nor_dx_2k.jpg",
            "bytes": 5664401,
            "md5": "e1b78b45dde854401d82cfc7d4dcf6e5",
            "sha256": null
          },
          "arm": {
            "url": "https://dl.polyhaven.org/file/ph-assets/Textures/jpg/2k/forrest_ground_01/forrest_ground_01_arm_2k.jpg",
            "bytes": 1160819,
            "md5": "bb5d791e2697b0b4b8703963c42a70d4",
            "sha256": null
          },
          "disp": {
            "url": "https://dl.polyhaven.org/file/ph-assets/Textures/jpg/2k/forrest_ground_01/forrest_ground_01_disp_2k.jpg",
            "bytes": 1036491,
            "md5": "50750c4535f53817d141412e819f7aea",
            "sha256": null
          }
        },
        "4k": {
          "diff": {
            "url": "https://dl.polyhaven.org/file/ph-assets/Textures/jpg/4k/forrest_ground_01/forrest_ground_01_diff_4k.jpg",
            "bytes": 10044373,
            "md5": "79a4c855c08b3057578e13aa3c312002",
            "sha256": null
          },
          "nor_dx": {
            "url": "https://dl.polyhaven.org/file/ph-assets/Textures/jpg/4k/forrest_ground_01/forrest_ground_01_nor_dx_4k.jpg",
            "bytes": 19077870,
            "md5": "956afa250f7322f331da1d536bab664e",
            "sha256": null
          },
          "arm": {
            "url": "https://dl.polyhaven.org/file/ph-assets/Textures/jpg/4k/forrest_ground_01/forrest_ground_01_arm_4k.jpg",
            "bytes": 4166080,
            "md5": "82169fcd5b1c7aac792e7e74186a4d47",
            "sha256": null
          },
          "disp": {
            "url": "https://dl.polyhaven.org/file/ph-assets/Textures/jpg/4k/forrest_ground_01/forrest_ground_01_disp_4k.jpg",
            "bytes": 2999702,
            "md5": "ea692b13ab49cb59d9b678f9ced5404b",
            "sha256": null
          }
        }
      },
      "current_engine_tiling_per_m": 0.25,
      "blend": {
        "height_scale": 0.7,
        "blend_width": 0.35,
        "min_weight": 0.1,
        "parallax_depth_m": 0.035
      }
    },
    {
      "index": 2,
      "id": "aerial_rocks_04",
      "display_name": "Rock",
      "role_tags": [
        "rock",
        "legacy-cliff"
      ],
      "biome_tags": [
        "mountain"
      ],
      "compatibility_locked": true,
      "source": "polyhaven",
      "page_url": "https://polyhaven.com/a/aerial_rocks_04",
      "license": "CC0-1.0",
      "license_url": "https://creativecommons.org/publicdomain/zero/1.0/",
      "authors": {
        "Rob Tuytel": "All"
      },
      "files_hash": "dc43dffab8e915bc54ac64899dcfe8cec826f8b9",
      "physical_width_m": 80.0,
      "physical_height_m": 80.0,
      "colour_space": "sRGB",
      "normal_convention": "DirectX",
      "moisture_affinity": 0.25,
      "cliff_suitability": 0.6,
      "uv_scale_multiplier": 0.05,
      "ambientcg_fallback": {
        "id": "Rock063",
        "page_url": "https://ambientcg.com/a/Rock063"
      },
      "notes": "80 m aerial scan. Legacy cliff_layer. Do not retile to 1:1 physical without a scene migration.",
      "files": {
        "2k": {
          "diff": {
            "url": "https://dl.polyhaven.org/file/ph-assets/Textures/jpg/2k/aerial_rocks_04/aerial_rocks_04_diff_2k.jpg",
            "bytes": 3001368,
            "md5": "9569319be1713474efad4ec1d7c0abe0",
            "sha256": null
          },
          "nor_dx": {
            "url": "https://dl.polyhaven.org/file/ph-assets/Textures/jpg/2k/aerial_rocks_04/aerial_rocks_04_nor_dx_2k.jpg",
            "bytes": 4296240,
            "md5": "4a5fc01dd4b9fced5ebb00a07aa799ff",
            "sha256": null
          },
          "arm": {
            "url": "https://dl.polyhaven.org/file/ph-assets/Textures/jpg/2k/aerial_rocks_04/aerial_rocks_04_arm_2k.jpg",
            "bytes": 934898,
            "md5": "d508600dcd1887336650cec3248d92b0",
            "sha256": null
          },
          "disp": {